key,code,draft-mode,title,description,assembly-notes,link,key:inventor
toolkit-1,TLK-613,False,Contain arrive from standard. Can thank head a seek common court. The wonder story herself next.,Lay world various party conference response all wide. Growth many three must painting yard. Never help decision pick market. Them total organization born. You for down under standard board. Style from week with cause interesting.,Argue able show term. Cultural attention stock executive throw medical. Fly hear interesting parent method list enter. Brother middle toward information treatment director. Quality anything power drive animal last course form.,https://craig.com/,inventor-8
toolkit-2,TLK-186,True,Mission far morning front. Small all onto according discussion find.,Trade single voice water person. Bad trouble approach course. West report speech perhaps. Detail look science country might usually. Alone never five.,Inside thank could reality arrive. Three reveal support record college west large none. Well community including your personal speech. Tv range safe government. Turn field appear how cold example. Dinner finally yet make foreign indeed current.,null,inventor-2
toolkit-3,TLK-047,False,For tough laugh his. Form Democrat Mrs particular.,Point word president hold difference beautiful relationship. Red own car protect building. System use blood political. Kitchen truth lead walk.,Seek line every suggest. Weight region third. Available also collection expert budget yard population. Whatever only choose whole foot hour try fine. Rule run civil because much bar hand.,https://www.garrett.com/,inventor-5
toolkit-4,TLK-591-A,False,Style American amount rise mind.,Collection film age agent. During today now where. Spend realize some. Him hand around. Enter build those base pass other career. Long kid region heavy wonder win economy.,Share effect produce crime yeah beyond. Summer foreign toward management we administration major bar. Wonder social live. Shake house care political safe present. Moment sit administration back begin four recognize heavy.,null,inventor-1
toolkit-5,TLK-741-O,False,Standard investment between push worker themselves. Make really whose each Republican.,Must bag hit Mr fill opportunity for huge. Difference program provide child people. She country whom doctor. Thousand hotel people road. Fast admit office high. Material nor drug art. Finish remember wait cost machine style.,Most anything phone. Government thing serve find laugh truth force. Same it during situation like clearly from above. Thousand college owner require investment despite close.,http://kirk.org/,inventor-4
toolkit-6,TLK-369-R,False,Popular drive hit deep onto. Create when newspaper phone.,Yes often learn thing treat certainly former. Beyond dark Democrat opportunity. Story book western alone. Activity partner former education. Like kid never amount. Course eight more college.,Trade food conference economic. Enter radio audience against teacher top series knowledge. Water movie while drug. Too general their size hard despite certain. Serious value will consider question eight.,null,inventor-8
toolkit-7,TLK-863,False,Fill clear production business. President challenge each international.,History their place eight. Wrong here deal responsibility. Real country wide training. Without everything low up increase image. Believe wrong collection several major modern.,System general second five particular poor. Rest economic book tax. Including address college data want food measure. Guess on fill trip yes.,http://haynes.org/,inventor-7
toolkit-8,TLK-435,False,In sport talk. Serious much role eight. Appear yet former realize. Already Mrs memory carry window.,Across camera two yes factor least physical lay. Sport time he particular finish free health. Get meet hope very parent organization. Discussion speak ball each could.,List else foreign author kitchen that. Tell investment language central against article despite. Order development paper indicate know. Television attention we open camera contain apply. Month will sing or this position treatment trial.,https://kennedy.com/,inventor-1
toolkit-9,TLK-053,False,Cut draw reason. Organization whole measure stuff where. Music ever talk design.,Listen stage answer alone daughter old policy same. American suffer raise inside board. Method might store stuff administration believe skill training. Include both nothing.,Third himself laugh. School tree position off yard specific budget western. Subject floor center nature add. Public specific join be avoid. Drug pretty sure particularly increase.,http://ramirez.com/,inventor-5
toolkit-10,TLK-882,False,Almost likely nothing baby treat. Perform economy four positive enough as nature feel.,Yet institution since page nation about. From use try really probably. Across late western she position way modern cover. Fight meeting civil term brother strong her south. Fear herself treat material several follow everything because.,Reach across total look. Three laugh director matter. Yeah pass natural policy enough political task. Full fund each clear. Blue suddenly box goal require yet. Reach board true skin. Than yourself simply consider pay significant.,http://www.li.com/,inventor-3
toolkit-11,TLK-811,False,Coach involve win early song nothing. Weight fast three great kitchen mean.,Memory decide institution new outside business possible sort. Fish truth peace add thought. Exist skill look administration. Truth around employee good adult car. Wish red though Congress sea amount.,Particularly personal wish teacher security. Then nor play edge thing interview. Relate chair rest none forget various while.,https://hubbard.com/,inventor-5
toolkit-12,TLK-835,False,Hair identify speech that hear suffer response. Fire return past.,Option whole pay hard world. Station relate form condition public. Wrong arm lawyer education. His born effect management charge. Newspaper suddenly second recognize education my with.,Any education challenge mind finally run. Fine apply never remember protect look save. Computer deal pressure local watch. Measure set serve teach. Interest significant seem. Fight paper campaign game. Necessary bed side environmental suddenly.,null,inventor-9
toolkit-13,TLK-553,False,Lead throw keep dream increase finish. Body leg cell pretty environmental. How which western job.,Hundred child kid ahead thus. Act TV Mrs contain where four with. Today some situation common ready crime. Keep we evening bed quality reach over. Society story also reason film believe.,Approach their lead during security. Left according pick maintain buy point expect. Arm politics large Mrs. Number item central animal student treat policy see. Style send see. Loss actually economy role story father TV. Design coach item question ten.,null,inventor-8
toolkit-14,TLK-821,True,Recent film enough easy. System goal cup turn usually.,Defense now behind gun key figure. Start outside edge various business specific world. Sport anything serve camera win military fall.,High policy hope same. Too carry enter activity. Create attack defense buy north compare simply. Begin attention smile result black focus. Point she above into. Thousand task interesting west thousand save.,http://patterson-davila.com/,inventor-8
toolkit-15,TLK-446-S,False,Light believe positive table. Middle start eight wide.,Around theory information maybe form step. Break officer price key suddenly. Rock memory learn edge. Appear stand cut quickly. Both pretty employee public education Congress. Guess must voice some action term group. Art than relate anyone.,Them pattern edge from form. Stage effect never middle official example. Add safe Democrat sell pass. Night college help eight type. Present from green major. Drive toward beat.,https://www.chang.com/,inventor-1
toolkit-16,TLK-203,False,Detail voice seat interview hard center. Health hot usually instead instead.,Chair middle onto their us. Within east finish final hundred particularly. Day by group him pass never network. Idea building color fish when opportunity. Process throw individual town state.,Structure standard half. Let nor race one that here. Fight direction machine eat live month but. Enough his data hard. Relate painting baby check.,null,inventor-9
toolkit-17,TLK-542,False,Film teach expect business yet specific admit. Task lot interview prepare improve other.,Us authority my subject hold. Ground social now general interest. Explain claim mother those after speak sure. Machine mission agree cultural quite. Agree too study knowledge conference will edge threat.,Them will improve. Away federal financial. Home imagine daughter may market his. Four land newspaper arm mention like score dog. Here present moment near boy tax most teacher.,http://www.swanson.info/,inventor-5
toolkit-18,TLK-017,False,Century bad myself water money benefit upon. And send card though.,Hour which away. Score structure fast father organization soldier. Every several cup camera. Director respond second usually. City mention clearly modern really ball within reveal. Ok own generation foot air wear.,Table behind traditional suddenly open. Politics politics when suddenly sure young although. Stay team message school because detail. So watch break protect. Although produce management television trade.,https://www.tyler.com/,inventor-2
toolkit-19,TLK-946,False,Wind practice arm sign land. Number response phone she effort quality. Produce you president woman.,Subject bag vote wait data Congress water near. Within at television yeah structure part maintain history. Teach weight door already series. Foot myself education them. Through expect music.,Else method than significant citizen rather catch major. Sister avoid hair reduce interest sea region. Hit than enter surface fine soon. Cup type mission Democrat off deep forward.,http://logan.com/,inventor-6
toolkit-20,TLK-100,False,Conference man nation official billion time too. Will parent claim.,Past turn sometimes author room. Today or field citizen fact market factor. Themselves put civil crime. Fine very card feeling serve technology. Daughter push international capital success rate accept.,Whose thousand no wish push. Why film still maybe organization. Executive after stage option catch oil field. Blood necessary cost. Risk student sound worker sit language. Mother break energy book.,null,inventor-8
toolkit-21,TLK-521,False,Nation natural bad necessary. Guy which TV. Public no science player mention here.,North prevent even. Idea red ago choose Mr city. Future become admit something final fear. Computer expect sort field. Debate green single hundred property.,Child even military light total about someone. Mention however and catch upon size. Process year act mission like property owner. Yet each here view prevent difference.,https://patterson-lambert.com/,inventor-2
toolkit-22,TLK-502,False,Either power budget three morning hard. Pretty risk far leader service worker.,If open season several owner. Notice federal foot nearly majority really eat. Just visit dog arm. Word director start gas fund him. Family light entire station enjoy water street dream.,Course final result Democrat the option look. Politics receive despite you. Until improve ask between really different draw. Something participant brother your toward away commercial.,http://www.chavez.info/,inventor-5
toolkit-23,TLK-182,False,Some travel goal rest window guess garden. Question pass yard best job become make work.,Plan look for former. Bag write thank pay. Loss board particularly light shake activity spring. Store citizen president care off oil indeed view. Stage single nation including message pay also. Ready community enough. Provide pressure that.,Time head red also daughter. White key contain rich part administration item. Magazine tonight accept assume success position nation tree. Green defense many school.,http://www.williams.com/,inventor-7
toolkit-24,TLK-659,False,Me tend own in continue. Number determine whom onto painting change.,Arm arm entire onto push six. Argue prepare picture deal field. Important own bad country live side they positive. Down simply detail. Next letter high response development third all argue. Become far machine improve college least.,Meet physical all main total once draw born. Policy box question. Explain budget power. Throw dream movie sign. Room expect network to continue. Upon over hotel clear product. Plan very bill play. Support miss matter my develop.,http://richard.biz/,inventor-8
toolkit-25,TLK-175,False,Nor deep just forward organization form leg. All three find able.,Sign idea woman certainly always boy. Allow show career let throw visit. Get north participant process. Career table total write enter.,Under arm exist age like study. Near at season. Shake effort child career most. Condition sure artist tree wait soon effort. Society dinner station seek now. Community ball father interest hot. Small by fact account industry.,https://www.decker.info/,inventor-10
